{
  "$schema": "dev-pipeline-feature-list-v1",
  "app_name": "TaskFlow",
  "app_description": "A modern task management application with team collaboration, real-time updates, and analytics dashboard",
  "created_at": "2026-03-04T10:00:00Z",
  "created_by": "app-planner",
  "source_spec": ".prizmkit/specs/app-spec.md",
  "features": [
    {
      "id": "F-001",
      "title": "Project Infrastructure Setup",
      "description": "Initialize the monorepo structure with Next.js frontend, Express backend, and PostgreSQL database. Set up ESLint, Prettier, TypeScript configs, and CI/CD basics.",
      "priority": 1,
      "estimated_complexity": "medium",
      "dependencies": [],
      "acceptance_criteria": [
        "Next.js app runs on port 3000",
        "Express API runs on port 4000",
        "PostgreSQL connection verified",
        "TypeScript compiles without errors",
        "ESLint and Prettier configs applied"
      ],
      "status": "pending",
      "session_granularity": "feature",
      "sub_features": []
    },
    {
      "id": "F-002",
      "title": "User Authentication",
      "description": "Implement email/password registration and login with JWT tokens. Include password reset via email, session management, and protected routes.",
      "priority": 2,
      "estimated_complexity": "medium",
      "dependencies": [
        "F-001"
      ],
      "acceptance_criteria": [
        "Users can register with email and password",
        "Users can login and receive JWT token",
        "Password reset flow works via email",
        "Protected API routes reject unauthenticated requests",
        "Session persists across page refreshes"
      ],
      "status": "pending",
      "session_granularity": "feature",
      "sub_features": []
    },
    {
      "id": "F-003",
      "title": "Task CRUD Operations",
      "description": "Core task management: create, read, update, delete tasks. Tasks have title, description, status (todo/in-progress/done), priority, due date, and assignee.",
      "priority": 3,
      "estimated_complexity": "medium",
      "dependencies": [
        "F-002"
      ],
      "acceptance_criteria": [
        "Create task with all required fields",
        "List tasks with pagination and filtering",
        "Update task status, title, description",
        "Delete task with confirmation",
        "Task validation enforced on both client and server"
      ],
      "status": "pending",
      "session_granularity": "feature",
      "sub_features": []
    },
    {
      "id": "F-004",
      "title": "Project & Team Management",
      "description": "Organize tasks into projects. Support team creation, member invitation, and role-based permissions (owner, admin, member, viewer).",
      "priority": 4,
      "estimated_complexity": "high",
      "dependencies": [
        "F-003"
      ],
      "acceptance_criteria": [
        "Create and manage projects",
        "Invite team members via email",
        "Role-based access control enforced",
        "Project-level task filtering",
        "Team member list with role display"
      ],
      "status": "pending",
      "session_granularity": "auto",
      "sub_features": [
        {
          "id": "F-004-A",
          "title": "Project CRUD & Organization",
          "description": "Create, read, update, delete projects. Associate tasks with projects."
        },
        {
          "id": "F-004-B",
          "title": "Team & Permissions",
          "description": "Team creation, member invitation, role-based access control."
        }
      ]
    },
    {
      "id": "F-005",
      "title": "Real-time Updates",
      "description": "Add WebSocket-based real-time notifications for task changes, comments, and team activity. Show live updates without page refresh.",
      "priority": 5,
      "estimated_complexity": "high",
      "dependencies": [
        "F-003"
      ],
      "acceptance_criteria": [
        "Task status changes appear in real-time for team members",
        "New comments trigger live notifications",
        "Connection status indicator shown in UI",
        "Graceful fallback when WebSocket disconnects",
        "No duplicate notifications"
      ],
      "status": "pending",
      "session_granularity": "feature",
      "sub_features": []
    },
    {
      "id": "F-006",
      "title": "Analytics Dashboard",
      "description": "Dashboard showing task completion rates, team productivity metrics, overdue task tracking, and project progress visualization.",
      "priority": 6,
      "estimated_complexity": "medium",
      "dependencies": [
        "F-004",
        "F-005"
      ],
      "acceptance_criteria": [
        "Task completion rate chart (daily/weekly/monthly)",
        "Team productivity leaderboard",
        "Overdue task alerts and summary",
        "Project progress bars",
        "Date range filtering for all charts"
      ],
      "status": "pending",
      "session_granularity": "feature",
      "sub_features": []
    }
  ],
  "global_context": {
    "tech_stack": "Next.js 14 + Express.js + PostgreSQL + Prisma ORM",
    "design_system": "shadcn/ui + Tailwind CSS",
    "testing_strategy": "Jest (unit) + Playwright (e2e)",
    "deployment": "Docker + Vercel (frontend) + Railway (backend)",
    "language": "TypeScript"
  }
}
